text	label
አሜን አሜን አሜን መአረይ እንደንዚህ ያሉትን ደጋግ ሰዎች ያብዛልን ያኑርልን  ፈጣሪ	positive
እስኪ ከክላስ ፎርፎ እኪደወል ሽንት ቤት የተደበቀ ምስኪን 	positive
ትንሽ ብትገፋ ፀበል ይዛ ነው የምትመጣው ስልህ 	neutral
በዋሽንግተን ዲሲ በዛሬው እለት በሞጣ ጉዳይ በኢትዮጲያ ኤምባሲ በፈርስት ሂጅራ የተዘጋጀ ዝግጅት	positive
ዳኛ ውሳኔ ከመስጠታችን በፊት የፍርድ ማቅለዬ አስተያየት ይኖርሀል  ተከሳሽ  የማንቼ ደጋፊ መሆኔን ግምት ውስጥ አስገቡልኝ	neutral
ይሄ ጥናት በቶሞካ ቡና ስፖንሰር የተደረገ ነው	neutral
አይዞን  አጥሚት ምናምን ፍቱን መድሀኒት ነው 	neutral
ይሄ የምታዩት ተራራና ሸለቆ በሙሉ እርሻቸው ነው እህል ተሰብስቦ ጎተራ በገባበትና መሬቱ ረፍት ላይ በነበረበት ወቅት ነበር የሄድኩትየአካባቢው ሰው በመንገድ ሲያልፍ ነዋሪውን ሰላ	neutral
የሀገር ህልውና እና ጥቅምን እናስከብር ሲባል ግብፅ አባት ሀገር ሆና ኤርትራ እናት ሀገር የምትሆንበት ስሌት አይገባኝም 	neutral
የሚያሳየን ክልሉ ተግባሩን በተመለከተ ያለው አቋም ከውግዘት በተቃራኒ ተራ እንደሆነ ማሰቡ ነው ተግባሩን ለማረም እርምጃ ከመውሰድ ይልቅ ያቃጠለውን ሽብርተኛ አካል ላለማስከፋት ሲል ሙስ	negative
ሀ ሀ ሀ አቶ ዳንኤል ክብረት መዥረጥ ያደረገውን ስልጣን አላዬህም	neutral
ለቤት ተቆራጭ ብዙ ታማኝነት ነው ይአ ሲ ኢ ምኤ	neutral
ወደ ስራ  በወሪ ገደላችሁን  ጉራ ብቻ	negative
ባሀሩን የምታደፈርስ መስሏት አሞራ አለማወቋ እና ለውንብዳናዋ ትልቅ ባህር ላይ ትሸናለች እንጂ የሷ ሽንት ትልቁን ባህር የማደፍረስ አቅም የለውም  አቦ ለማ መገርሳ  በሰላም አሜሪካ ገብተዋል	negative
   እርሱ በእግዚአብሄር መልክ ሲኖር ሳለ ከእግዚአብሄር ጋር መተካከልን መቀማት እንደሚገባ ነገር አልቈጠረውም ነገር ግን የባሪያን መልክ ይዞ በሰውም ምሳሌ ሆኖ ራሱን ባዶ አደረገ	neutral
የጠሚው ብሄራዊ ደህንነት አማካሪ ማን መሆኑ ጠይቅ  እንዘጥ	negative
 በተነሳው ሰደድ እሳት ከ ሚሊዮን በላይ እንሰሳት ሞተዋል  	neutral
ተጨዋች መሀመድ ናስር ጠፍቷል ወደ ክለቡ ተመልሶ አያውቅም የት እንደገባም መረጃ የለም ሀድያ ሆሳና ለኢትዮጵያ እግርኳስ ፌደሬሽን መጥፋቱን አመልክቻለሁ ብሏል    	neutral
አታላይ ንቤ ደከመች ዛሬ 	positive
ለምን ተስፋ እንቆርጣለን ለምንስ እንዋረዳለን ከኛ እሚጠበቀው መጣር መስራት ስህተትን ቶሎ ማረም አለቀ	neutral
 እነዛው የትላንቶቹ  ህወሀት ጠፍጥፎ የፈጠራቸው ኢህአዴግ ተብዬ አባላት የህዝባችን አሳሪዎች ገራፊዎች ገዳዮችና የአገር ሀብት ዘራፊ ሌቦች  የቀን ጅቦች  ዛሬ	neutral
በተጨማሪም አሽከርካሪዎች የትራፊክ ሁኔታ ቀድመው እንዲያውቁና አማራጭ መንገዶችን እንዲፈልጉ መረጃ የመስጠት ህጎችን የሚተላለፉ አሽከርካሪዎችን የመለየት እንዲሁም የአደጋና የደህንነት	neutral
ሲሉ ያስረዳሉ ይህ ሁሉ ሲሆን ግን የከተማ አስተዳደሩ ምክር ቤትም ሆነ የካቢኔ አባላት ባላቸው ስልጣንና ሀላፊነት ሁኔታውን ለማስተካከልና ለመጠየቅ ሲጥሩ ብዙም አይታዩም ምክትል ከ	neutral
ከ በላይ መስጂዶች ሲቃጠሉሲፈርሱ  የሀገር ሰላም ዋጋው ስንት መስጂድ ነው በማለት ጠይቀናል  አሁን ደግሞ  ከ  ቦታዎች በላይ ህዝበ ሙስሊሙ ሰላማዊ ሰልፍ ሲወጣ  የ	neutral
     የአማራ ፖለቲከኞች የአገው ህዝብ ላይ ያደረሱት እና እያደረሱ ያሉት በደል ይቅር የሚባል አይደለም የአገው አክቲቪስ	neutral
የራሳችሁንም እጣ ፈንታ አልያዛችሁም እንኳን የኛን ኢትዮጵያ ብትፈርስ ወይ   ብትገባ ግን በርግጥ ሙሉ ሀላፊነት የናንተ እብሪት እና ጥጋብ ነው እናንተን የምናኖር መሰላችሁ ቆሻሻ ጥጋበኞች	neutral
እኔ ራሱ የወሲብ ታሪኮችን አንብቤ ከጨረስኩ ብኋሏ ነው ኮሜንት ላይ  ጌታ ይገስፃችሁ ብዬ ምኮምተው 	neutral
አንቺ  ልጅ እየተበላሸሽ ነዉ ከነማን ጋር መዋል  ጀምረሽ ነው  ዋ	negative
ምሽት በአማራ ክልል አገው አዊ ዞን አዮ ጓጉሳ ወረዳ እሁዲት ከተማ ቤተክርስቲያን ለማቃጠል ሙከራ አድርገዋል የተባሉ  ግለሰቦችን ለመያዝ የአካባቢው ማህበረሰብና የፀጥታ ሀይሎ	neutral
 በአርማጭሆ ህፃናትን እና ሾፌሮችን በማገትና ገንዘብ በመጠየቅ ሰላም በማደፍረስ ሲንቀሳቀሱ የነበሩ ወደ  ግለሰቦች በቁጥጥር ስር ዋሉ	neutral
ሀሀ ሳይሆን አይቀርም	neutral
አቃቂር  እውነት ነው አህመዲን ሞጣ አልሄደም ሞጣ ነው አህመዲን ጋር የመጣው አሉ 	neutral
እንደ አገር መኖር በአብዛኛው የአረብ አገሮች ፍላጎት ስለነበር ይህንኑ አቋማቸው ለማለዘብ ደግሞ አቢይ አህመድ ከአረብ አገሮች ጋር ጥሩ የዲፕሎማሲ ስራ እየሰሩ ነው 	positive
በሀሳብ አለመስማማት ደግሞ ሀሳብ ማጣት እንዳልሆነ ማወቁ ጥሩ ነው	positive
ዮሀንስ ቧ ያለው ለአማራ ህዝብ ምን ጠቀመ 	neutral
እንደ አንተ አይነት ሰው እና አስተሳሰብ ሳይ ኢትዮጵያ ትንሳኤሽ እሩቅ ነው እላለሁ የተጨበጨበልህ ደነዝ ነህ	negative
ይሄን ስታይ የሻንቅላ ጦርነት ማስነሳቷ አይቀርም ብዬ ነው	neutral
ኢትዮጵያ ታሪክ ብቻ ሆና መቅረቷ የተረዳው አብይ አህመድ ክሽፈቱ ለማወጅ ዳር ዳር ማለት ጀምሯል	neutral
የ አም ሀገራዊ ምርጫ ረቂቅ የጊዜ ሰሌዳን በተመለከተ ከባለድርሻ አካላት ጋር ውይይት እየተደረገበት ይገኛል  የባለድርሻ አካላት አስተያየትና ግብአት ይሰጡበታል ተብሎ እንደሚ	neutral
 በድካም በብርታት በማግኘት በማጣት የማትለየኝ ጌታ በቀንም በማታ ያላንተ አንዳችም እንዳልችል አውቃለሁ አቅም ጉልበቴ ነህ ኢየሱስ ወድሀለሁ  	neutral
አሜሪካዊ ያገባች የግቢ ጓደኛችን ነበረች ከሰርጓ ቀናት በፊት ቤቷ ሄደን ስናወራ የነገረችን ተመሳሳይ ነበር እኔን ለብሩ ብለሽ አይደል ሲ	neutral
ሁሌ ተዝረክርኬ ስወጣ ነው እንዴ ማፈቅራትን ልጅ ማገኛት 	neutral
ኦሮሞ ሚባል ግሩፕ አለ  የግሩፑን አባላት ቢያሳውቀን መልካም ነበር ንቀቱን እንኳ መደበቅ አይችልም	positive
ሲሮጡ የታጠቁት ሲሮጡ ይፈታል እንዳይሆን  በውህደቱ እኛ ብቻ ነን ልክ ካላሉ  እውነተኛና ሰላማዊ ምርጫ ከተደረገ  የመጪው ምርጫ በውህደቱ ላይ ሪፈረንደም ይሆናል	neutral
ድሬዳዋ ደምቢደሎ  አምቦ እና ወለጋ ዩኒቨርሲቲዎች ተዘግተዋል   የብልፅግና ኦአኦ የብልግና መሪ መቼ ነው ቁጭ ብለህ ለህዝብ የምታገለግለው መዞር መዞር መዞር ደደብ መሪ	negative
የፕራይቬታይዜሽን አዋጁ በቀላሉ ወደኋላ ሊመለስ የማይችል ዘላቂ ተፅእኖ ያለው በመሆኑና አስቸኳይ ባለመሆኑ ተግባራዊ መሆን ያለበት ሀገር ተረጋግቶ መክሮበት በመሆኑ በችኮላ ፀድቆ ወደተግባር እንዳይ	neutral
የመጨረሻ እስትንፋሳ እስኪያደርጉ ድረስ ከፍተኛ ስቃይ ይሰማዎታል  የደምዎ መስመር ይሰቃያል እናም ከሞተ በኋላ ወደ ሲኦል ዋሻዎች ይገባል ከሰራው ሀጢአት	negative
ሌላው የ ትልቅ ዜና የኢትዮጵያ አየር መንገድ ንብረት የሆነው    የተከሰከሰበት አደጋ ነበር በአደጋው የ 	neutral
አንተ ምናልባት የዜግነትህንየብሄርህን አግኝተህ ይሆናል አብዛኛው ወጣት ግን እነታከለ ኡማን ተስፋ አድርጎ ወሬያቸውን	neutral
እንኳን ሰማይ ላይ ባንዲራሽን አይቶ ስምሽ ሲጠራ ማን ዝም ይላል ሰምቶ  እንኳን ሰማይ ላይ ባንዲራሽን አይቶ ኢትዮጵያ ሲባል ማን ዝም ይላል ሰምቶ    ኢትዮጵያ ለዘላለም ትኑር	positive
ያው ታክሲ ውስጥ ምናምን ማለቴ ነው ልክ ሳንፈልግ ጆሲን እንደምንሰማው	neutral
መከላከያ ምኒስትር ለማ መገርሳ የኢትዮጵያና የአሜሪካን የሁለትዮሽ የመከላከያ ትብብር ለማጠናከር ዛሬ ጠዋት ዋሽንግተን ዲሲ መግባታቸውን አምባሳደር ፍፁም አረጋ አስታወቁ	negative
እኔ በአመት የማላገኘውን የደሞዝ መጥን 	neutral
ደግሞኮ በዚህ ቀን ካልገባችሁ ትባረራላችሁ ፒሪረም ፓራራም እያሉ ምስኪኑ ላይ የሚቀልዱት ነገር ነው ደሜን የሚያፈላው አንድ ባለስልጣን ልጅ በነ	neutral
ህግ እና ስርአትን የሚያስከብር መንግስት አለ ብለው ደህንነታችን ይጠበቃል ብለው አምነው ለትምህርት ከቤታቸው የወጡ ተማሪዎች ለምን ታገቱ ይህን ያህል ጊዜ መንግስት የት ነበር	negative
እንኳንም የስላም ስልፍ አደረገላችሁ ውድ ወገኖቼ ክፏችሁን አያስማን የኛ ጨዋዎች	positive
ደስሲልሱዳኖች ሌላአለምላይናቸው	positive
የእኛ ፖለቲካ ማጥቂያ እየሆነ ነው እንደርግማን ሆኖ በቁሙ ያለውን አማራ እየረዳነው አይደለም ዋና ሳጅን አበበ ይትባረክ	neutral
መሪን በጥረቱ መመዘን ድንቅ ቸርነት ነው ለፖለቲካዊ መሪዎች አይሆንም እንጂ	neutral
ነገር ጥቁር ሽፋን ያለው የተረሳ ነገር ባህር ዛፍም ይታጠን 	neutral
አቶ መኮንን ደመቀ     ህወሀትን ገፍተን ውህደት እንዴት ይሆናል አይታሰብም አሉ የተባለው እውነት ነውዴ	neutral
በቃ ሰገራህን በየ አደባባዪ ትፀዳዳለህውርደታቸውን እንደ ክብር ያያሉ   ደነዝ	negative
እስኪ ለዚህ ሰው ትንሽ ሰላም ብንሰጠው ሁሉን ያሳካል አማራው ኦነግ ሲለው ኦሮሞው ነፍጠኛ ሲለው ትግሬው ጠላቴ ሲለው ይሄ ሰው ምን ይሁን	neutral
መንግስት እንደኛው ዞሮበታል  	negative
ጎን ለጎን ሚዛን አስጠብቃለው ጂም ከመሄድ ይሻላል በማለት ነው በአካል ለመወፈር ብዙ መርሳት ያለብኝ ጉዳዮች አሉ   አካበድኩት	neutral
ላንተ አይደለም	negative
እኔ ደግሞ የባርሳን አንተም ከነትርጉሙ እችለዋለው እንቁልልጭ  	negative
ምርጫ ካርዱ ዱባይ የሚታተም ሲሆን ድምፅ ቆጣሪውን ላለማንገላታት ከእነ ውጤቱ ቢታተም እላለው	neutral
ከአመታት በፊት ይሰራበት የነበረው አጠቃላይ አስመጪ የሚል ፈቃድ እንዲቀር ተደርጓል የንግድ እና ኢንዱስትሪ ሚኒስቴር እንደሚለው የንግድ ስርአቱ ችግር እንዳለበት በመረዳት ማስተካከ	negative
እስኪ ኮርርርር በል ኮተት የናዚ ጃዋርን ምስል ይዘህ እስክንድርን የመናገር ብቃት ኬት አገኘህ ቦቲ ራስ	negative
ይህ እኮ በ ቀን የተፈፀመ ብዙ ሰወች ያዩት ወንጀል ነው  በ ጄል አሳምነው መሪነት በዘምርነ እና ማስረሻ አ	negative
ውይ ቻይና ውይ መቼ ነው ግን ካንቺ ደህና ነገር ሚገኘው	negative
ምስክር የሌለው ሰው ይሄንን መፅሀፍ ሊያገኝ አይችልም ወይ  እኔ ከሳቴ ብርሀን ተሰማ የፃፉትን የዱን የአማርኛ መዝገበ ቃላት  ብር ገዝቼ አውቃለሁ በብላክ ከመርካቶ አሮጌ ተራ	neutral
በአማራ ክልል የተከሰተውን የነዳጅ እጥረት ለመቅረፍ እየተሰራ መሆኑን የክልሉ ንግድና ገበያ ልማት ቢሮ አስታወቀ	neutral
ደግሞ ጃዋርን የሚደግፍ ሁሉም ወያኔዎች ማለት ጀመራቹ ትንሽ ቆይታቹ ኦሮሞ ሁሉ ምን ልትሉት ይሆን	neutral
መስጠት ማለትስማኝ ለኔ እደሚገባኝ  ልብን ማዘጋጀት በጎነት ማሳየት መንፈስን ማሳመን  መጨመር ደግነት ከሁሉም  ከሁሉም በርግጥ መስጠት ማለት ቀና ነገር ማሰብ ቅን ሆኖ መገኘት	positive
በአሁኑ ሰአት አብይን መደገፍ ምርጫ አይደለም ግዴታ እንጂ	neutral
አይፍሩ   ወደ የዊካ ጎኑ ወደዚህኛው  ወደ የሱፍ ሶስተኛው መጨረሻ ይምጡ	neutral
  ከብልፅግና ወደ ኦሮሞ ፓርት ዝውውር የሚያደርግ ከሆነ አሁን ከሚካፈለው  በሶስት እጥፍ አሳደገን  ለመክፈል ዝግጁ ነን ምን ትላለህ መኮ	neutral
የክልሎች ግንኙነት ረቂቅ አዋጅ ላይ ለመወያየት የአንድም ክልል ተወካይ አልተገኘም ኢፕድ   እስቲ የሀገር ለሀገር ግንኙነት ብላቹ ጥሯቸው ይመጣሉ ሰዶ ማሳደድ	neutral
የሚደንቅ ነው እሺ ስለ ፕሬዝደንት ነጋሶ አሿሿም የተናገረውስ መፅሀፉን ያነበበ ሰው እግረ መንገዱን ቢያረጋግጥልን ሸጋ ነበር	negative
ሰለቸኝ ጌታን ሰው ወደ አውሬነት እየተለወጠ ነው ደከመኝ ደከመኝ ጌታ ሆይ አረ ምን አይነት ዘመን ነው ሰው ፔጅ ላይ ሄዶ ያንን ሰው ሙሉጭ አርጎ መስደብ ምን ይሉታል መሳደብ ይቀላል ወይስ ያንን ፔጅ አለማየት	neutral
አቶ ለማ መገርሳ መድረክ ላይ ሆነው ውህደቱ አስፈላጊ አይደለም የመደመር እሳቤው አያስኬድም አላሉም አማራጭም አላቀረቡም አቶ ታየ ደንዷ  	negative
ድህነት ላይ ድህነት መደራረብ ምስኪን ህዝብ	negative
የኢትዮጵያ አየር መንገድ ግሩፕ መሰረታዊ የሰራተኛ ማህበር ሊቀመንበር ካፒቴን የሺዋስ ፈንታሁን እንደገለፁት ምንም እንኳ በተቋሙ አለቃ የመፍራት መንፈስ የቆየ ቢሆንም በአሁኑ ወቅት	neutral
እኔን በመናቅ ምክንያት አንቺን እና ቤተሰቦቻችሁን የሚያስፈራራ የ  አጋንንትን ቁጣ ትጋፈጣላችሁ	negative
የመመረጥ እድሉ ሰፊ ይሆናል ህዝቡ ደራሽ ይፈልጋል እምነት መጣል ይፈልጋል እንፈልጋለን በዘር ከፋፍሎ ህዝብ  ከህዝብ	neutral
የአገር ውስጥ ምርቶች ብቻ የሚቀርቡበት መድረክ	neutral
ልትበጣጠስ አንድ የተቃረነ አረፍተነገር ከመሪው እየጠበቀን የነበረን ህዝብ  አሁንም እንደሀገር መመራቱ አያስገርምም እኔ ተአምር ነው ባይ ነኝ	neutral
አሳዳጆች ነበር አሁን ደሞ በተራችን ተሳዳጆች ሆንን አለህ እኮ ህሊናው የቀጣው እና ጥፋቱን ያመነው ቢኒያም ከትህነግ ውስጥ አንድ ጥፋቱን ያመነ ሰው	neutral
ይገባቸዋል  ሁሌም  ከጎንህ ነን  የቁርጥ ቀን ልጅ አስተዋዮ መሪዬ 	positive
ጥንካሬያችሁ የሚለካዉ መጀመሪያ ለአባላቶቻችሁ ዋስትና መሆን ስትችሉ ነው እነ ክርስቲያንን አስፈቱ	neutral
    ይለኛል እንዴ  ሸይኽ አህመድን ጀበሉ ሀፊዞሁሏህ   ይበልጥ ጀበል ሆነ	neutral
የመጀመሪያው ገዢ ነው የምሆነው 	neutral
የፕሪምየር ሊግ ስድስተኛ ሳምንት ቁጥሮች እና እውነታዎች	neutral
ለአንተ አይደለም በለኝ አምላኬ ይቺ ልጅ 	neutral
ከባለቤቴ ራቁ  ወደኋላ አቆይ ወይም አደርገዋለሁ ቁጣዬ እና ስቃይህ ወሰን የለውም  ደምህ መንገዶቹን ቀይ ያደርጋቸዋል ስቃይ ብቻ አይሰማ	negative
ይቅርታ አድርግልኝና አህመዲን አሁንም ቢሆን የተባለው ንግግር የቱ ህገመግቢያ መሆኑን ማስረጃ ማቅረብ አልቻለም የአፄው መንግስት ለሙስሊሞች አስከፊ እነደነበር	neutral
ከድስቱ ነው እቱ ወይም ከቁሌቱ ሽሮን የመሰለ የለም የምግብ ብርቱ	neutral
መሪዬ ጌታ በደሙ ይሸፍንክ ስላንተ ሳስብ ይደክመኛል እንደ ድፎ ዳቦ እሳቱ ነደደብክ በጣም ነው እምታሳዝነኝ ዬ መሪ  አብይ አህመድ በፀሎትም በድምፅም ከጎንህ ነኝ	positive
የ ኦሮሚያ ክልል የሚንቀሳቀስ የ አሸባሪ ቡድን 	negative
የ   ጣእም በአለም አቀፍ ደረጃ እውቅና እንዳለው ያውቃሉ	neutral
ለአማራ ብሄርተኛ ግን እምቢልታ የሚነፋበት ጊዜ እንዳለፈ አሁን ለእሱ እምቢልታ መንፋት ፀያፍ እንደሆነ እየተናገርኩ መሰለኝ	neutral
 እኔ የማውቀው መሀል አዲስ አበባ ተወልጄ ማደጌን ነው ነገር ግን ከነጮቹ  የሸዋ ገበሬ የእህል ማሳ እና የአደይ አበባ ውበት ይቀርበኛል ብዬ አስባለሁ	neutral
በሆሳእና ለኦርቶዶክስ ዜሮ ካሬ ለአህዮች መቆሚያ ሺህ ካሬ ለፓስተሮቹ ለዮናታን  ካሬ ለሳህሉ  ሺህ  ለእስራኤል ዳንሳ  ሺህ ካሬ	neutral
ሲዳማ ራስን የማስተዳዳር ጉዞ ጥናታዊ ፅሁፍ ፊላታ ቦሮጄ ቃዬርዲን ተዘራ ጋር የሰሩትን ጥናት አቅርበው ጥሩ ውይይት ከብቃት ያላቸው እንግዶች ጋር ማድረጋቸውን ገለፁ	positive
በክርስቶስ የባሰው መጣ  የቤተ ክርስቲያን ስልጣን ነው እንደ መሪ ጌታ ወይስ የ  አዲሱ 	neutral
ችግሩን ከመሰረቱ መፍታቱ ነው የሚያዋጣም ማለባበሱ አይጠቅምም	positive
ዘውጌ መቼም ቢሆን ብሄርህን ካልቆጠርኩ ነው የሚልህ	neutral
ሰው ባለስልጣን ሲሆን የአክስቱን ልጅ መርዳት ያቆማል ወይም አይችልም ያለው ማነውይኼን ለማድረግ እኮ የሚጠይቀው ሰው መሆን ብቻ ነውያው የአጎቴ ልጅ ስለሆነ ነው ይቅርታ	neutral
ተብድረው መክፈል ባይችሉ ባንኩ ከተማውን ሊወርሰው ነው	neutral
እኔና የቀን እንቅልፍ አንተዋወቅም	neutral
ረዳቶቹ ሴት ቢሆኑ ኖሮ ፓርቲ ትቀይራለህ	negative
መቼም ከናንተ የተሻለ ሲመጣ ያማችኋል ይህ የህውሀት ክፉና መጥፎ በሽታ ነው	neutral
የኢትይፕጵያን ኡነተኛ አመሰራራት እና የረጀም ጊዜ ያላቋረጠ መንግስት ግንዛቤ ውፅት ሲገባ ነው ፌደራሊዝም የሚለው አካሄድ ትክል መልክ ሊይዝ	neutral
እኛ እሄንን ድርጊት ከማውገዝ ይልቅ ዝምታን የመረጡበተለይ ወጣቶቹ የጢቅት ሰዎች የጥፋት ተልእኮ ማስፈፀሚያ የሆኑተቋሞቻችን የተሰጣቸውን ሀገራዊ ግዴታ መወ	negative
ብፁእ አቡነ ማቴዎስ እድሜትን ያርዝምልን  አባታችን በሰአሊተ ምህረት ቅማርያም ቤተ ክርስቲያን እጅግ በሚደንቅና ልብን በሚያስደስት ቃል አስተማሩን የአመት ሰው ይበለን	neutral
በፈሳሞች ላይ ቢጀመር ጥሩ ነበር	negative
እነ አፄ ሚኒሊክ የሚሉት ኡነት ነው ኢትይጵያ በሀዛብ እና በአረመኔ ከግራኝ ጀምሮ ብዙ ተሰቃይታለች  ትክክል ለመሆኑ ማንኛውም የ	neutral
ለገና ከወጡ ዝማሬዎች ውስጥ የተባረኩበት ድንቅ ዝማሬ  በዜማ ለክርስቶስ አማኑኤል የሚለው ነው      በ      በሚማርክ መንገድ ውብ ተደ	positive
እንኳን ለብርሀነ ልደቱ በሰላም አደረሰን አደረሳችሁ መልካም ልደት በአል 	positive
የፈሪ ዱላው አቅመ ደካሞች ላይ ነው ጉልበት አለኝ ብሎ ውጊያ የገጠመማ ወታደር እንጂ ተማሪዎችን ከመንገድ አፍኖ አያግትም ሰላም የማይጥመው በሀገሪቱ የተበተነ ማፍያ ሁሉ አቅመ	neutral
እውነት ነው  ግን ምን አለበት እውነተኛ ለሆነው እስክንድር ነጋ  ለእውነት የቆመውን እስክንድር ነጋን አንተም ነፃነቱን ሰጥትህ እሱን እንደመከርከው አንተም ደሞ	positive
የአማራ ባለስልጣናት በሀሳብ መሞአገት አቅቶት ተገዳደለኦሮሞ ግን በሀሳብ እየተፋጬ ነው እና የቱ ነው ስልጡን ህዝብ ወይስ ስልጡን መሪ ባሻዬ  ማፈሪያ	negative
በኦዴፓ ከፍተኛ አመራሮች መካከል የተፈጠረው ልዩነት  የግብፅ ጋዜጦች ዋነኛ የዘገባ ርእስ ሆኗል እንዴት ነው ግብፅም ፌደራሊስት ሆነች እንዴ እንደው ለማወቅ ያህል ነው 	neutral
የኔ ውሻ የኔ  ኪሎ የኔ  ቁጥር የኔ ፊክሪ  እንዴት ሆኜ የወለድኩትን ልጅ እናቱ ውሻ ትለው የእለት መጣያ ሰበብ አታሳጣኝ በቁንጥጫ ለምዝጌ አሁን በኛ ማርሽ ወደቢሮ እየቆስኩት ያሁነያ	neutral
ስብሰባ መከልከል ብቻ ሳይሆን የህግ እውቅናውም ሊቀማ ይገባል  ይህ ሀይል ነው ሞጣ ላይ የ ሙስሊሞችን መስጅድ እና ንብረት ያወደመው	negative
ኢህአዴግ በክህደት ነዉ የፈረሰዉ  የህወሀት ጉባኤተኞች እሁድ ማምሻውን አስቸኳይ ስብሰባቸውን ሲጠናቀቁ ባወጡት የአቋም መግለጫ ኢህአዴግ በክህደት ፈርሷል ብልፅግና ከተባለው ፓርቲ ጋ	negative
እኔ ከቶቹ እንደ አንዱ መሆኔን አውቃለሁ 	positive
 በጣም እያስቸገሩን ስለሆነ ወለጋ እና ወያኔ መጥፋት አለባቸው  መንግስቱ ሀማርያም	negative
ለህብረተሰቡ ጥቅም ነው የምንሰራው እያላችሁ የምትምሉ የምትገዘቱ ሚዲያዎቻችን እስቲ አንዴ እንኳን ለቃላችሁ ታመኑ የጋዜጠኝነትን ሀሁ ተወጡ	positive
ይሄ ዜና ነው ስብሰባው ከመደረጉ  በፊት ማለት ትችሉ ነበር	neutral
የቀን ጅቦች ጉራ መሆን አለበት  እንጂ ጤነኛ አንጎል ያለው ገንዘቡንና ስሙን እንደው ዝም ብሎ አያጠፋም	negative
እንደምን አደራችሁ ቀናችሁን በእውቀት ጀምሩ በአዲሱ ኪዳን አገልጋይ የህዝብ አለቃ አይደለም እንደ ስሙ አገልጋይ እንጂ ዘወትር ሰኞ ምሽት  ከሚሰጡ ተከታታይ ትምህርቶች	positive
ዛሬ በመዲናችን አዲስ አበባፊንፊኔ ታላቁ የአካል ብቃት እንቅስቅሴ ተካሄዷል  በሁላችን ጥረት ስፖርት የህዝባችን ባህል ይሆናል	positive
እንደ አይን ብሌን ጠብቀኝ በክንፎችህ ጥላ ሰውረኝ	positive
ጎጃሜዎች እንዲህ የሚል ስድብ አላቸው   እንጭቅ  ምን ማለት እንደሆነ ግን አላውቅም	negative
በጥቂት ወሮ በሎች የዋህ እና ያልበሰለ አእምሮአቸው ስለተሰለበ ነው ብዬ አምናለሁ እኛ  እድሜ ስናድግ ይህ መርዛማ ስርአት ገና ስር አልሰደደም ነበር አሁን ግን እውነታው ሌላ ነው	neutral
