text	label
ገቢና ቁጭ ብዬ ከኋሏ የተቀመጠችው የሰፈራችን ልጅ ሰላም አለችኝ በቃ አርፈሽ ቁጭ በይ ይከፈልልሻል 	neutral
በጋራ እንሰጣጥ የሚለው አማርኛ ምን ይመስልሀል ታድያ አንቴ	neutral
ሰልፉ የተካሄደው መነሻዉን ቀበሌ  ከሚገኘው ትልቁ መስጊድ አድርጎ በመስቀል አደባባይ በኩል በፓፒረስ አደባባይ በአዴት ተራ አድርጎ የጊዮርጊስ ቤክርስቲያን በሚገኝበት አደባባይ ዞ	neutral
እኛ እኮ  መተሳሰብ ያነበረን መረዳዳት ያጀገነን ልዩነት ያልለያዬን ፍቅር ያሻገረን በውብ ቀለም የተቀለምን ኢትዮጵያውያን ነን	positive
አዳዲስ ግምገማዎች አሁን እንደ கடடண  የትየሌሌ እናም ግምገማዎች ላይ	neutral
ጥሩ ሰው ሁን   ጥሩ ሰው ለመሆን እንዴት ህግ ያስገድደኛል ይላል ሰው    ምግባርና ጨዋነት እንዴት በህግ ይደነገጋል   አብዱ አሊ ሂጅራ ከመአዛ ብሩ ጋር	neutral
ረጅም እድሜ ይስጥልኝ የጊዜ ጉዳይ እንጂ ይሄ ነገር እውን መሆኑ አይቀርም 	positive
በጣም ቀላሉን ስህተት ከሂሳብ አለመቻል ጋር እያገናኙ እንዲህ መገልፈጡ ይህ ነገር ከፍየሏ በላይ ነው ያስብላል 	neutral
ፍትህ ለህሊና እስረኞች	positive
ልባችሁን ዛሬ የሞላው ምንድን ነው  በፍቅር የተሟላ ልብ ከውስጡ ፀጋ የተሞላበት ንግግር ይፈልቃል    	positive
የአብይ አህመድ አካሉ እንጅ ስልጣኑ በሪፐሊክ ጋርድ አይጠበቀም	neutral
የህወሀት እና ብልፅግና ፓርቲ ጉባኤ ህወሀት በኢህአዴግ ውሀደት ዙርያ የመጨረሻ ውሳኔውን እንደሚያሳውቅ የሚጠበቅበትን ጉባኤ ቅዳሜ እና እሁድ ያደርጋል	neutral
ለምትመራው ህዝብ  ያለህ  ከበረታ  ሊስተካከል ይገባዋል	neutral
ለነገሩ እንዳተ አይነቱ አባትና አያት     መለየት ያቃተህ ሁላ አፍና አካውንት መክፈትህ ይገርማል	negative
በምን ይገለፃል የትውልዴ አበሳ  ከመንበርከክ ብዛት መራመድ የረሳ  ያልፋል ተለጉሞ  ያልፋል ተከርችሞ  የጉልበቱን ኮቴ ምድር ላይ አትሞ                                  በስ	neutral
የውስጤ  ሀሳብ እሷ ታውቃለች  የቃላት ማነሱ ችግር የለውም ያለውን ይበቃ ነብር  ኤድቷን በትኖርልን ጥሩ ነበር እንጂ ያሬድዬ	neutral
ሀገራችን ለዚህ መብቃቶ  በጣም ያሰደሰታል  እግዚአብሄር ይመሰገን  አሜን	neutral
የሴሌብሪቲ አይኑካችንን እንዳገኘን ለማሳወቅ ያህል ነው ሙዚቃን ለዚያውም ሊድ ጊታር የተማረች የቸከ ወሬ የማትዘበዝብ   ጃዝ ፍሪደም ነው ትልሀለች 	neutral
ይሄን ብቻ ሳይሆን አሳ ነባሪ ሆድ ውስጥ ዮናስ ለ ቀን ተኝቶ መተፋቱንም አምናለውአይደለም  ይሄን አሳነባሪውን ዮናስ ዋጠው ተብሎ ተፅፎም ቢሆን አምናለው በቃ አምናለዋ 	negative
የሁለት አለም እናቶች  መሽረፍት በአንድ እጁ የአዲስ አበባ አረጋውያን እናቶችን እንጀራ ያጎርሳል በሌላኛው እጁ	negative
እኔ ገለልተኛ ሜዳ ለማፈላለግ እስማማለሁ 	neutral
ያ የሚሳካው ትክክለኛ እና ሀቀኛ መሪ ሲገኝ ብቻ ነዉ ከህዝብ በመደበቅ  ከሩቅ እና ቅርብ ባሉት አገራት ምስጥራዊ ግንኝነት እና ስምምነት ማድረግ መቆም አለበት	positive
በ ፈረንጅ  ድንቁ ኦሮሞ ጉግሳ  ይለዋል እንግዲ ሪሻርድ ፓንከርስት   ዛሬ እንደሆነ አልቅህ እኔ ሙግት አምጣ ወይ እመን  ሚቆጭህን	neutral
እንደ ፈለክ ኳስ ብቻህን ማየት የለማ 	neutral
ነፃነት በዱላ እያላችሁ ወርቅ የሆነ የወጣትነት ግዜያችሁን በማይረባ ፀብ ጫሪዎች በሚለኩሱት እሳት አታንዱ ይሄ ግርግር ለናንተ ታዝኖ ሳይሆን የግል ብልፅግና ማግኛ ዘዴ እንደሆነ ግል	positive
እንኳን አደረሰህ ታላቁ መታዘዝ ከምፅዋት ይበልጣል የኛ ብርቱ	positive
አማራ  ጎጠኛ አይደለም   አማራ  ነን  ብለው  በጎጥ የሚያወሩ  እውነተኛ  አባቶቻቸውን  ያስፈልጉ መላው ኢትዮጵያ  የአማራ እና የሌሎች  ሁሉ ሀገር  ነው	positive
ዩኒቨርሲቲ ደሴ ካምፓስ ዛሬ ረፋድ ላይ የተፈጠረውን የፀጥታ ችግር ለማረጋጋት በቅንጅት እየተሰራ መሆኑን የዩንቨርሲቲው ፕሬዝዳንት ዶክተር አባተ ጌታሁን ገለፁ	neutral
ውሀ ቅዳ ውሀ መልስ የኢትዮጵያ ፖለቲካ ቀጥ ያለ ሲታጣ ይመለመላል ጎባጣ  ሆነ እኮ ነገሩ	negative
ኛ እግዚያብሄር በበሀሪው ቅዱስ ነው ለቅድስናውም መጠን አይወጣለትም  ሀጥያት የማይስማማው ቅፅስና ነው ያለው ማለታችን ነው እንደፍጡራን የዝንባሌ ውጣት ሳይሆን ባህሪው ነው እየ	neutral
ዛሬ በአአ ቦሌ ኤርፖርት መግቢያ ታላቅ የወንጌል የምስራች በሀይልና በስልጣን ተሰበከ 	positive
ለሀገር ሰላምና ለህዝቦች አንድነት የወጣቶች ሁለንተናዊ የነቃ ተሳትፎ ወሳኝ ነው	positive
ታላቁ እስክንድር ታሪክ እንደምትሰራ ስናገር ያላንዳች መጠራጠር ነው  ድል ለዲሞክራሲ	positive
ወዳጅነትንም አየሁት ከአንድም ሁለት ሶስቴ ከሰው ጋራ ልኖር እያለኩኝ ደጄን በመክፈቴ ፈርሶብኛል ቤቴ ቴዲ ታደሰ	neutral
የህይወት ውሀ ጒድጓድ የገነት ምንጭ እሱ ኢየሱስ ክርስቶስ ነው የአብ ኀይሉ ቀኙ ሀሊናው ነው የአለሙ ኹሉ ደስታ ክርስቶስ ተወለደልን	neutral
አትታገልና ኢዜማ ኢዜማብርሀኑ ብርሀኑ ስትል ክረም ራስህን ማብቃት ሲያቅትህ በሌሎች ኪሳራ ለመወጣጣት መሞከር ግብዝነት ነው  ም ሆንክ ርእዮት ከሞራል ወለል በታች ነህ	negative
ያ የምትፅፉት ታሪክ የህፃናት ትቤትን ከአንዴም ሁለቴ ተመላልሶ በክላስተር ቦምብ ከደበደበ መሪ እና ድርጊቱ እንኳን ሊያወግዙ ተጨማሪ ክላስተር ቦምብ መግዣ ሲያዋጡ ከ	negative
ከአቀንቃኝነት ወደ አናቂ ቢሸጋገሩ ደግሞ የበለጠ ጥሩ ማስተካከያ ይወጣው ነበር	negative
መልካም ነገር ለማድረግ ጊዜ ያጣ ሰዉ መልካም ለመሆንም ጊዜ አይኖረዉም ሪቢንድራት ታጎር	positive
የመኪና አደጋን ለመከላከል አዲስ እይታና አቀራረብ ያስፈልገናል   የመኪና አደጋ ዜጎቻችንን እየበላ ነው ዛሬ በደህና ከቤታችን ወጠን በጤና ስለመመለሳችን አብዝተን የምንጨነቅበት ወ	neutral
እንኳን አብሮ አደረሰንውል ውል አለኝ ደጅሽ ድግል ሆይ እልልልልሰሰሰሰሰ	neutral
ማንም ከማንም ጋር እኩል አይደለም ሁሉም ግለሰብ የተለየ ነው         እኩልነት ወደ ሰው ልጅ አእምሮ ሰርስሮ የገባ እጀግ አፍራሽ የሆነ ሀሳብ እንደሆነ ልነግራችሁ እወዳለሁ	neutral
 እሺ ወንድሜ እተከላለሁ ማኛ እኮ ናት ወዳታለሁ በጣም ደሞ  ቅና አሉህ 	neutral
ቀጣዩን  ሳምንት ፕሮግራሞን ያቅዱ የአንድ ወር የስልክ ስክሪን ሴቨር ትሁናቹ 	neutral
ፓፓፅ ፍራንሲስ ይህን የ ምልክት ስለ የሴቶችን ቤተሰባዊ ጥቃት ከማውገዛቸው ትንሽ ሳት በፊት አንድን ሴት ስትይዣቸው ለማስለቀቅ ብለው እጅዋን በጥፊ መተዋል	neutral
እኛ ኢትዮጵዮውያን የራሳችን አዲስ አመት አለን የለንም ላሉት ከሆነ ጥሩ ነው ግን ዘርዘር አድርገው ለማን	neutral
መግደርደሬ ፋሽን ነው አለች ጎንደሬዎች ግን ይህን ሁሉ ዘመን ፋሽን አይከብድም 	neutral
በሰኔ  ከፍተኛ የመንግስት ባለስልጣናት ግድያ ተጠርጣሪ ተከሳሾች ላይ ብይን ተሰጠ	neutral
እለተ ምፅአት ዛሬ ነው ቢባል እንኳን ተስፋ አትቁረጥ ገንዘብህን ጊዜህን እና ዘመንህን በከንቱ አታባክን የእውቀት እና የገንዘብ ድህነት እንዳያጠቃህ ነቅተህ ትጋ ባለህ ነገር ሁ	positive
ይሄን እንተርቪው ዛሬ በእስራት ሚዲያ  እስከማይ ድረስ እስክንድር በባለጊፈሬው ኦብሳ ፍርሀት መንበጭበጩን አላውቅም ነበር	positive
ምነው ከዛስ አበዛህ ሀገሪቷ አንድ ሆና አማራ ሳይኖር ነው መኖር የምትፈልገው መሰል ይቅርታ እኔ በሞተ ሀገር እና ማንነት አማራ ይሙት አልልም ነ	neutral
ኢዜማ  ሴቶች   የኢዜማ ዞናል የሴቶች ስብሰባ ከአምስት ዞኖች ማለትም ከጋሞከወላይታከሰገን ህዝቦችከሀድያከካጠና እና ከጎፋ ዞኖች የተወጣጡ የሴት ተወካዮች በተገኙበት ዛሬ በ	positive
ተክልዬ ፀሀይ ፃድቃን በአባታቸው መንግስት እንደ ፀሀይ ያበራሉ ማቴዎስ 	neutral
 መንግስት ብቻውን ነው የዞረበት ለማለት ነው 	negative
ጀበሉን ድምፁን ሲሰሙ እና ዘመድኩን እና ስዩም ተሾመ   	neutral
ብአዴን የሚባል የጠላት ፍጥረት የአማራ የተባሉ ተቋማትን እና ድርጅቶችን ለመጥለፍ እና ለማዳከም የሚያጠፋውን ጉልበት በሌሎች ተቃራኒ ተሰላፊዎች ላይ ቢያውል የት በደረሰ ነበር	negative
የ አዞ እንባ መሆኑ ነው ድንቅ ነው	neutral
እኔ ሚመስለኝ ከሆንክም የምታታልለው ምስኪኑ የአማራን ጠላት ነህ ወያኔ የጫነብህ የዘር አስተሳብህን ደብቀህ ሳናውቅ ለብዙ ግዜ ሸውደህናል አሁን ተነቃብሽ ዘረኛ ነህ	negative
የድሀ ልጅ ጭቅላት የሚቀላ የእሱም ጭንቅላቱ ተቀልቆ መገደል አለበት  ሀዘናችሁ  ሀዘኔ ነው	neutral
ሳሙኤል ሲታወስ  የወረዳ  የኢዜማ ወጣቶች ክንፍ በወጣትነቱ ለሀገሩ መስዋእትነት የከፈለውን ሳሙኤል አወቀን ማስታወሻ በማድረግ ውይይት ተደረገ	positive
እንስሳ ብቻ ሳይሆን ሰዉም እንደሚበላው አዉቃለሁ እዚሁ እኛ ሀገር እንኳን ለብዙ ነገር ሱጠቀሙት አይቻለሁ እዛ በነበርኩበት ጊዜ	neutral
ኧረ ጌታ ይቅርታ ይበልህ ይሄ ለምንም አይመችም	neutral
የዥብ ችኩል ቀንድ ይነክሳል ይባላል ቆይ ረጋ ብለን የነፋሱን አቅጣጫ እንመልከት   ምንአልባት ነፋሱ ወደ ቶሮናዶ ከተቀየረ ባይሆን መጠለያ እንዳናጣ 	neutral
ጥሩ ቀማሽ ነው ለማለት ነው	positive
ሆንግ ኮንግ የፈረንጆቹን አዲስ አመት በተቃውሞ ተቀበለች	negative
ከፍተኛ የክልልና የፌዴራል የስራ ሀላፊዎች በሰሜን ሸዋ ዞን ደብረ ብርሀን ከተማ ከክልሉ ባለሀብቶች ጋር የንቅናቄ 	neutral
እነግርሻለሁ ሀና  የብሄር ጭቆና ትርክቱ ወደ ባርነት አድጎ የዘር አቀንቃኙ የነፃነት ታጋይ ሆኖ ሲቀርብ ነገሩ ደነቀኝ         	neutral
አቤቱ እንደበደላችን ሳይሆን እንደቸርነትህ ይቅር በለን እግዚኦ	positive
የቁርአን አሰባሰብና ጥበቃ ኮርስ ትምህርት ሶስት	neutral
ምንም ልካም እለተ ሰንበት ከሰንበት እረደኤትና በረከት ተካፋይ ያድርገን	positive
የሩሲያው ፕሬዘዳንት ቭላድሚር ፑቲንና የጀርመኗ መራሂተ መንግስት አንጌላ ሜርክል በሰሞነኛው የመካከለኛው ምስራቅ ሁኔታ ላይ ለመወያየት በመጭው ቅዳሜ እለት በሩሲያ እንደሚገናኙ ሮይተር	neutral
ታድያ  ቅጀታቹ  ለምንድ ነው ለባህር በር  ምድረ  ቱልቱላ 	negative
ጠንክረህ ተማር ወይም ስራ	positive
ለንደዚህ ድንቁርና ጥላቻና የደም ማፍሰስ አራራ ያለው ግለሰብም ሆነ የተደራጀ ቡድን ወይን ፓርቲ የዲያቢሎስ መጫወቻ ከመሆኑ ውጭ ሞት ብቻ ነው የሚሰጠው ትርጉሙ	negative
ፓ  አናመሰግንም እኮ እኛ ሰዎች ስንባል ቪቫ መንግስታችን	neutral
እኔን ደሞ የመጨረሻ እድሏን እየተጠቀመች ይመስለኛል	negative
የአማራን ህዝብ ህልውና በማስጠበቅ የኢኮኖሚ ተጠቃሚነቱንየፖለቲካ ውክልናውንማህበራዊ ተቋማቱን በማጠናከርና ለጥያቄዎቹ መልስ በመስጠት አገልግሉት እንጂ አ	positive
ሰው እያረጀ ስሄድ እየቀለለ ነው እንዴ የሚሄደው እድሜ አስተማሪ መስሎኝ ምን የሚሉት ቅሌት ነው ይሄ	neutral
ገሪዎችም ለጥፋታቸው ካሳ ይክፈሉ ይሏቸዋል ቦረናዎቹ አልተስማሙም የገሪ የቦረና የሚባል መሬት የለም    ኤላውንና ውሀውን እንዴ	positive
በአዋልድ ስም  ጄኒ ክሩሴ  አስራ ሶስቱ አጋንንት  ይህንን ሰው በዘለፋ ስቃይ ውስጥ በመንፅሄ ነበልባል እንረግማለን ሰይጣን መስማት ወይም መፀለይ ይ	negative
እዚያ ጠብቅ እና እሄዳለሁ	neutral
ላሊበላን ስጎበኝ ወደ ግራ ስዞር የሆነ ዋሻ አየሁ በጣም ጭለማ ከዛ ማታ እንቅልፍ እምቢ አለኝ ፈርቼ አልጋ ልብሴን ይዤ  ተኛሁ ከዛ እንደምንም በ እንቅልፌ መጥቶ ዞር	negative
የአማራክልል አመራሮች እንዲ ጭንጋፍ ሆነው   የሆኑት ከመቼ ወዲነው ብልህነቱም ጥንካሬም ህግ ማስከበሩም ማስትዳደሩ ተሳናቸው	negative
ጥያቄ  እግዚያብሄር በሁሉ ቦታ ካለ ለምን በሰማይ የምትኖር እያልን እንፀልያለን  እግዚያብሄር በሁሉ ቦታ የሚገኝ ከሆነ ለምን ቤተ መቅደስ እንሰራለታለን	negative
እሁድ እለት ከአምናው ቻምፒዮን መቐለ  እንደርታ ጋር የምናካሂደው ታሪካዊ ግጥሚያ ሊያመልጥዎ አይገባም እሁድ ወደ አሸናፊነታችን የምንመለስበት እለት ቅዱስ ጊዮርጊስ የኢትዮጵያ እግር ኳስ ንጉስ	neutral
ሸገር ታይምስ ሚዲያ ሰሞነኛ ጉዳዮች   ኦፌኮ የጃዋር ጥፋት ማስፈፀሚያ ካባ ነው የሚሆነው  ኦሮሚያ ልዩ ፖሊስ የተዘጋጀው ለምር	neutral
ፓስታ የእንፋሎት ማፅጃ አይደለም	negative
በአዲስ አበባ የመሬት የሊዝ ጨረታ በይፋ ከተቋረጠ በርካታ ወራት ቢቆጠሩም አሁንም ህግን ባልተከተለ መንገድ መሬት እየተከፋፈለ ነው	neutral
የዘንድሮው ገና ካሁኑ ፓለቲካ ፓለቲካ እየሸተተኝ ነው  ቲቪ ቻላኖቹ ሁሉ የጋበዙት ፓለቲከኞችን ነው 	neutral
ሆድ መሪዬ ዶክተር አብይ ከአንተ ብዙ ነገር የምጠበቅ የኢትዮጵያ ነኝ አንተን ወደ መልካም ሰራ እንድትገባ ሁሌም የአቅምን እደግፋለው በርታ ነው የምለክ አምላክ በሰራ በመንገድ ሁሉ ይከተል ሆድ መሪዬ	positive
ዘመኑን የማይመጥን ትግል እያካሄድን ዘመኑ የመጠነ ውጤት ልናመጣ አንችልም	positive
አሜን ይመጣል    ደስ የሚል ዝማሬ ነው ዘማሪ ጵኒኤል ጌታ ይባርክህ ተባረክ     በቆንጆና ለአይን በሚማርክ ቀረፃና ኤዲቲንግ መልእክቱን አድርሶናል ተባረኩ	positive
ሉቃስ    መንፈስ ቅዱስ በዚያች ሰአት ልትናገሩ የሚገባችሁን ያስተምራችኋልና	negative
የትራፊኮቹን ጉቦ መቀበልና እዝላልነት በሹፌሮች ብቻ ማሳበቡ ተገቢ አይደለም	negative
ያለውን ትውልድ መጠበቅ ያልቻለ እንዴት ለ ይመኘናል  ነው ወይስ እስኪጨርሰን ነው የሚቆያው 	neutral
ከቅማንት እና ትግሬ የምትሮጥ አማራ ከኤርትራ መዋጋት አማረህ ዝም ብላቹ እረፉ ካልሆነ ከግብፅ ሆነን ኢትዮጵያ ወደ  ሀገሮች እንከፋፍላታለን	neutral
ሁለት አይነት አገራቸው የሚወዱ ሰዎች    ጠላትን ወዳጅ በማድረግ ጠላቶች የማይፈልጉትን ሁሉ እርግፍ በማድረግ ሌላ ስብእና መፍጠር   የተገነባ ማንነት ላይ ሳይደራደር አጠንክሮ	neutral
ሞቶ ተቀብሯል እኮ አሁን መቃብሩን በኮንክሪት ስለመስራት ነው የምናወራው ከትህነግ አሽከርነት ነፃ የወጣች ሀገር የማንም አሽከ	negative
በኦሮሚያ ውስጥ ተፅእኖ ፈጣሪ የሆኑት ሶስቱ ፓርቲዎች ጥምረት ለብልፅግና ስጋት	neutral
አልገባው ላለ አናቱ ላይ ትምህርት ቤት አትሰራበት	negative
ከህወሀት አቸኳይ ስብሰባ ምንም አዲስ ነገር አይመጣም ያው ከዳተኞች የሚለው አዲስ ዜማቸው ብቻ ነውየትግራይ እድል በትግራይ ወጣቶች እጅ ነው	negative
አሁን ባለው ሁኔታ ተልባው የሚያስፈልጋቸው የ ማንቼ ደጋፊዎች መሆናቸውን ለመረዳት ችለናል	neutral
ይሄን ጉድ ሳላወራ ብተኛ ደግ አይደለም ይሄው ቴሌ ለመስተናገድ ወረፋ ስጠብቅ ቀኑን ሙሉ ውዬ ሲስተም የለም ብለው መለሱኝ አላለችም 	negative
የኔ እመቤት ቋንቋዉን አለመናገርሽ ሊወቀስ የሚገባዉ አንቺና ቤተሰብሽ እንጂ ሲዳማ ብሎ ክልልሽን አክብሮልሽ የነበረወስርአት አይደለም አንተ ኢዜማ	negative
እናንተ ለ አንዳንዶቻችሁ ነገ መግቢያ አንድ አንድ እና ከዚያ በላይ መፅሀፍ እንደሆነ ታውቃላችሁ አይደል  በሉ ይዛችሁ ከች በሉ	neutral
ዳንኤል    እነሆም አንዲት እጅ ዳሰሰችኝ በጕልበቴና በእጄም አቆመችኝ	neutral
መቼም ማስተዋል መልካም አይደልእዚ ገፅ ላይ የፃፋትን እርሶን ጨምሮ አምባሳዳር እራሴንም ሳለይ መሆኑ ነውያለንበት አገር መለያየቱ ባይገርመኝምየሁላችን ቀን	positive
ኧረ እኔን ጨምሮ ብዙና እልፍ አእላፍ ወንዶች አለን ቀልብ መግፈፍ ግን ደስ ይለኛል  ስለ ባል ምርጫው መልካም እድል 	neutral
ምን አገባህ  የትግራይ  ለትግራይ ህዝብ በሚጠቅም መንገድ ነው መስራት ያለበትአጨብጫቢ አይደለም	negative
ሰዎች ለህፃናት  የሚያሳዩትን ቅንነት  ለምን ለአዋቂዎች ማድረግ ይሳናቸዋል	neutral
ለጠቅላላ እውቀት   በአድስ አበባ የክርስቲያኖች ባለአደራ አስተዳደር ሰብሳቢ ማን ነው  ሽልማት አለው	neutral
ያ እውነት አይደለም	negative
በሴራችሁ እየበተናችሁት እያኮላሻችሁት  እንዴት ብሎ ወደ አንድ ይምጣ ኢሳት እንኳን አራተኛ መንግስት ይሆናል ብለን ተስፋ ያደረግንበትን ተቋም አሽመድምዳችሁ ቁጭ አደረጋችሁት	negative
ፕሮፌሰር ብርሀኑ ነጋ አቶ አንዳርጋቸው ፅጌ እና የድርጅቱ ከፍተኛ አመራሮ እንኳን ወደ እናት ሀገራችሁ ኢትዮጵያ በሰላም  ገባችሁ	positive
ነፍጠኝነት ለሀገር ሏላዊነት  ለህዝብ ነፃነት የቆመ ኢትዮጵያዊነትን በማያጠነክር  ጎጠኝነትንና ዘረኝነትን በማስውገድ አንድነትን በመ	neutral
ለማያውቀው ያሳውቁ ካልፈለግን የስማነው አለመስማት ብቻ ነው የሚጠበቅብን	neutral
አበረ አዳሙ በአማራ የሚከሰቱ ሁነቶች ተጋነው እንደሚተረጎሙ የተገነዘቡት ገና ትናት ነው  በአማራ ክልል ላይ የተከሰተውን ፈተና በመተንተን ረገድ ከእርሳቸው የተለየ እይታ ያላቸውን ሟ	neutral
ይህ ምርጥ ውይይት አያምልጣችሁ	positive
መፅሀፍ ቅዱሱን ማንበብ ሳይሆን መተግበር ነው አማኝ የሚያስብልህ የመፅሀፍ ቅዱስ ጥቅስ ጠቅሰህ ፍትሀዊ ለመምሰል አትጣር ሁሉም ባኖብሀል	neutral
ኢሳያስ እኮ ነው ያለህ ንገረው 	neutral
ብራቮ ኢዜማ  ኢዜማ በወለጋ  ጊንጪ  አርሲና አምቦ ከተሞች ህዝባዊ ስብሰባውን ሊያደርግ ነው	positive
ባልተለመደ መልኩ በርከት ያሉ ሴቶች ስልጣን ላይ በሚገኙበት ወቅት የብዙ ሴቶች እገታ ችግር አለመፈታት የሚገርም ነው  ፍትህ ለታገቱ እህቶችና ወንድምች   	neutral
ሀሳብን በነፃነት የመግለፅ መብት የድሞክራሲ ኦክስጅን ነው ይባላል	neutral
በጉጉት የሚጠበቀው ታላቁ የአርሰናል እና ማን ዩናይትድ ፍልሚያ	neutral
ታቦተ ህጉ ለእግዚአብሄር በካህናታ ህፅርት ወበመንፈስቅዱስ ክልልት ንጉስኪ ፅዮን ኢይትመዋእ ለፀር ወኢየሀድጋ ለሀገር በካህናት የተከበብሽ በመንፈስ ቅዱስ የተከለልሽ የእግዚአብሄር ታ	neutral
ኢራን ለምንድነው ትዝ የምትለኝ 	neutral
እውነተኛ ዲሞክራሲ ስለተመሰረተ እንደግፍ ያለ ተፎካካሪ ድርጅት የለም	negative
፬ የአመሻሽ ጉዞዎ መዳረሻ ወደ ኤርታእለ የተጠጋ ስፍራ ሲሆን በእሳተ ገሞራው አቅራብያ ማደር ያስፈልጋልይህም ለጉብኝት ምቹ ሰአት ለማስተካከል ነው የእግር ጉዞው በአስጎብኚዎች ከ	neutral
ስለዚህ እያንዳንዳችን ጥቃቅን የምንላቸውን በየቀኑ የምንሰራቸው ክፉ ወይም መጥፎ ስራ ላለምስራት አንስራ ለመፈፀም ቀላል ነገር ግን በልምድ እና ጉዳት የማያመጡ አየመሰለን አንሰራለ	positive
የአዲስ አበባ የህብረት ስራ ማህበራት ኤጄንሲ ለበአሉ መሰረታዊ የፍጆታ ሸቀጦች ማቅረቡን አስታወቀ	neutral
ደረቱቷ ጋር አይደል 	neutral
ኮሌኔል አለበል አማራ የክልሉ የመብራት ሀይል ዋና ስራ አስፈፃሚ ሆኖ ይሾምልን ይሾምልን 	neutral
ብሪታኒያ በቀጣናው የሚስተዋለውን ውጥረት እንዲያረግቡ የኢራቅ ባለስልጣናትን አሳሰበች	positive
ድንጋይ ራስ ደደብ ስለሆንክ ነው እንጂ ፈርጥጠህ መቀሌ ሄድክ ፈርጥጠህ ዙምባቤ ለውጥ የለውም ፈርጣጭ ፈር	negative
 ረጅም ጊዜ ነው ብየኮ  ነው  እኔኳን አላስታውስም 	neutral
እውነተኛ ታሪክ ነው  ልጁ ዛሬ አገር ቤት ስልጣን ላይ ነው ታግ አድርጌ ልረብሸው አልፈልግም ከነ አያቱ ቀይሮታል እውነት	neutral
አሁን አሁን     ከፍታው ቀርቶብን በቅጡ ዝቅታችንን እንኑረው   መከባበሩ ቀርቶብን በአግባቡ እንዋረድ   መፍቀሩ ቀርቶብን በቅጡ እንጠላላ  ሰላሙ ቀርቶብን ቀውሳችን ይቅ	neutral
በተመሳሳይ ሰአት የሸገሯ ብሌን ዮሴፍ አምሳሉን እያጫወተች ነፍሳችንን ባታድናት ማን ይታደገን ነበር እኮ ማን 	positive
ጥር   የሀላባ ዞን አስተዳደር በመንግስት ቃል ተገብቶልኝ የነበረው የሀላባ ዩኒቨርሲቲ ይገንባልኝ ሲል ጥያቄ አቅርቧል	neutral
አንገት እንጂ ደረት እዛ ሄደ እንዴ  	neutral
