text	label
  ትሀነግህወሀት ተሰናብቻለው ያለችውን ዜና ባበሰርችን ሰአት የክት ልብሳችንን በደስታ ሰብሰን የሀላው ከሌለ የለም የፊቱ በማለት ፎቶ ገጭ ተነስተን ለበአሉ ድምቀት	neutral
ይህ መጠን ደግሞ ላለፉት  አመታት በድርጅቱ ሳገለግል የነበረ እና አሁንም የሚጠቀስ ነው በመሆኑም አሁን እና በቀጣይ የሚከሰቱ ችግሮችን ከወዲሁ አስቸኳይ እርምጃ	neutral
የአባቶቻችን ታሪክ እንደግማለን ያልከው ልጅ  እንዴት ነህ ደህና ነህ 	neutral
እንደገና ደግሞ ጠቅላላ ጉባኤ መጥራት ወዘተ እና መሰሎች ቀላል ስራዎች አይሆኑላቸዉም እያሉ ነዉ    ሞተን ነዉ	neutral
አማራ  ጠላትህ ቤትህ ዉስጥ ነዉ ያለዉ አማራን ወይም የክርስትና እምነት ተከታዮችን  ቆራርጠን ነዉ እምንጥላችሁ    ባህርዳር   ላይ ለአማራ ህዝብ የተሰጠ ማስጠንቀቁያ	negative
ስለምን እንደምናወራ ግልፅ እንዲሆን ነው 	neutral
እዚ ደሞ በነ ሚኒልክ አያት ሳሀለስላሴ ይታወቅ የነበርው ክራፍ  ያ ጋላ ቤተሰብ በ ራስ ጉግሳ የሚ መራ ሲል ተመልከት እና እስቲ ንገረኝ የኔ አማራ	negative
ኸረ ተይኝ  ስንቱን ትንኝ አባረን እንደምንችል እኮ ነው ግራ የገባኝ	negative
አሁን ሁለት ሰዎች በኢትዮጵያ ታሪክ እንደ አቢይ ያለ ቅን መሪ አልነበረም የሚል ሀሰት ወሬ ሲያሰራጩ ተገኝተው ከገፄ በ ተባረዋል  ተመሳሳይ እርምጃዎች ተጠናክረው ይቀጥላሉ	negative
ማን ሆኖ ነው ኤሪትራን የሚናገርባት ማን ሆኖ ነው የሚሰድበን	neutral
ሼክ መሀመድ አሊ አላሙዲ ለአንድ ወጣት ህይወት የሚለውጥ የገና ስጦታ ሊያበረክቱ ነው ነገ ጠዋት በኢትዮኤፍኤም የማለዳ የበአል ልዩ ዝግጅት ላይ ይጠብቁ ከጠዋቱ  እስከ	positive
አንወሻሽና እኛስ የአረብ እና የቱርክ ነገስታቶችን እንድናደንቅ ተመልሰው በመጡ ብለን እንድንናፍቅ ተደርገን አይደለም እንዴ ያደግነው አድገን ስናየው ማን እንደሚሻል	neutral
ኧረ ምንድነው ጉዱ መፍቻ የሌለው እንቆቅልሽ ያሳዝናል	negative
ይህ ለኢዜማ የሴቶች ድጋፍ የትዊተር ገፅ ኢዜማን በሚደግፉ እና አባል በሆኑ እንስቶች የኢዜማን እንቅስቃሴ ለማስተዋውቅ የተከፈት ነው ይሄንን ፔጅ ፎሎ በማድረግ የኢዜማን የየእለት	neutral
እውነት ነው መቲ እሱ ሰው ነው	positive
አሰፋ የትዝታው ፈለግ ጀግና	positive
ከምርጫ በፊትና ከምርጫ በህሀላ የምትባል ድርድር ለህብ ጥቅም ወይንስ ለስልጣን ሽምያ የምር ማትገባኝ ንግግር ናት 	neutral
አይ ድንቁርና የአሜሪካ የፊልም አጃቢዎችን ለጥፈህ ኦሮሞ ምናምን ትላለህ አይ ዝቅጠት	negative
ሌላ የለህም   ደነዝ	negative
ምርጫ ቦርድም ነገሩን በቅንነት በማየት ጥቃቅን ግድፈቶችን ቸል በማለት ወደ ምርጫው እንዲገቡ ጥረት ማድረግ ይጠበቅበታል ብለን እናምናለን  እናምናለ	neutral
ኛ ሳምንት የኢትዮጵያ ፕሪምየር ሊግ ጨዋታዎች  ቀጥታ የውጤት መግለጫ	neutral
ሁሌም ምርጥ ቀን ይሁንልህ	positive
እግዚአብሄር በትእግስት ይባርከን  ትእግስት ከማጣት ብዙ ጉዳት በራስም በሌሎችም ላይ ማድረስ አለ ትእግስት ከማጣት ስፍራን መልቀቅ ፀጋን መጣል ከበረከት መጉደል አለ እግዚ	positive
እርስዎን አይደለም ጋሽዬ	positive
ለመላው የክርስትና እምነት ተከታዮች  እንኳን ለ አም ለገና በአል አደረሳችሁ በአሉ የሰላም  የፍቅር የመቸቻል ከምንግዜውም በላይ አንድነታችንን የምናጠናክርበት ባአል እንዲሆን መልካም ምኞቴ ነው	positive
ከፖሊተከኞች ጋር የሚደረጉ ቃለመጠይቆች ወሳኝ በሚባሉ ጉዳዮች ላይ ፓርቲዎች ያሏቸውን አቋም ለህብረተሰቡ ለመሳወቅ ማገዝ አለባቸው ብለን እናምናለንለዚህም ነው ቃለመጠይቆችን ካላቸው የፖሊ	positive
ዛዲያ ድርጅታችኹ መታገታቸውን ከሰማ ጀምሮ ምን ሲያደርግ ነበር  ከህዝብ እኩል እዚህ ላይ ስትጠይቁ አታፍሩም ነገ ብልፅግና ምናምን እያላችኹ ታወራላችኹ ልሳናችኹ ሳይታሰር	negative
የዜና ርእስ በሚል ቢስተካከል	neutral
የመጀመሪያውን ለመናገር አውሮፕላኑ ላይ ለመቆየት ይችላል ውሰ ውቀበደተየ ምን እንደነገራችሁ ማወቅ ነበረብን ውነድንም ጃምርእ ዩጣቀ ዎድቅእ ደንእ	neutral
እና እስከዛሬ ተበላን ማለት ነው	neutral
ይሄ አይን ግን ምን ይሻለዋል	neutral
ነጮች ሲተርቱ       ይላሉ እኛ ሊሂቃን ስለ ኢትዮጲያችን ባሰብንአገራችን በብሄር በ ሀይማኖት ተከፋፍላ ምትገኝ ከገባ	negative
ኢህአዴግ ባለፉት  አመታት ያደራጃቸውን ፓርቲዎች ይዞ መቀጠል ሲያቅተው ሌላው የኢህአዴግ ክንፍ ደግሞ ይዞ ለመሄድ እየሞከረ ይመስላል  ፕሮፌሰር	neutral
ማስታወስ ጥሩ ነው	positive
የ አም የሳይንስ ዝግጅቶቻችን ቅኝት በከፊል	neutral
አንድ አርብ ለት ከተማ ለመዝናናት ከ  በላይ ከሚሆኑ ጓደኞቿጋር ያመሻሉ እኩለ ለሊት ካለፈ በኋላ ወደ ግቢ በጋራ ለመመለስ እየተጓዙ ያልተገመተ ዱብ እዳ ያጋጥማቸዋል አ	neutral
ታህሳስ  ነው   ባለፈው ወር እንዳረግነው ወር በገባ በ ሶሻል ሚድያ ላይ የተለያዩ መልእክቶችን እናስተላልፋለን   ለዛሬ ይህንን መልእክት ሁላችንም ሼር በማድረግ ወይም ምስሉን	neutral
ዛሬ ማታ ዶሮ ለመስራት እየተሰራ መሆኑ ተገለፀ	neutral
ኧረ በገላጋይ እናንተ ሰወች እንዴ ሽማግሌም አትፈሩ በሉ አንቺም ተይ አንተም ተው	neutral
ንፍጣም ተሸክመከው ዙር ጥንብ ርካሽ	negative
ጎንደርን በሚገባ የተገነዘበው ብላቴናው የሙዚቃ ባለሙያ ቴዲ አፍሮ ነውጎንደር ጎንደር የኢትዮጵያ ዋልታና ማገርጎንደር ለኢትዮጵያ ታሪክ ማእከል	positive
ልጅ ሲራክ ብአል እስሀን ንአሀ ዝመስሉን ነዛ አብዛ ቭድዮ ዘላ አመንዝራ ናይ አባ ሻውል አይነት ዘርኢ ማህበር አንድነት አብ ፅርግያታት አስመራ ብድፍረት ተደሚ	positive
ወደ ጋምቤላ ብቅ በይ	neutral
የዴሞክራሲያዊ ስርአት ግንባታን ለማደናቀፍ የሚደረገውን ማንኛውም አይነት ሙከራ በምንም አይነት መልኩ አንቀበልም ብርሀኑ ነጋ ፕር	neutral
ለምን አንችልም	neutral
ሺ ጀምሮ ይቻላል ግን ለምን ያህል ህዝብ 	neutral
ፕሮፌሰር መረራ መራራውን ትግል የጀመረበት ሁኔታ ነው ያለው 	neutral
በለስላሳው ዋጋ እድሜውን ቁጭ እዚሁ	neutral
መንግስት እየወሰደ ያለው እርምጃ ከሚከሰቱት ወንጀሎች አንፃር ድክመቶች ታይተውበታል  ይህንንም መንግስት ና ህብረተሰቡ በጋራ መታገል አለበት  ስር የሰደዱ ፅንፈኞች አገሪቱን የኋሊት	negative
እና ከዚያ በፊት በጣም ረጅም ጊዜ ይሆናል ሀአ እኔ ማን ነበርኩ የሚል ማንም አልነበረም ልናሆይ ዜጊ ምጅረ ምጣበ ትፊበ ያዚከ ናእ	neutral
የአማራ ብሄርተኝነት ያነገባቸው ፍትሀዊ ጥያቄዎች የጉዞው ፍጥነትና ፈተናዎችን የመሻገር ብቃቱን በሚገባ ካየነው በአጭር ጊዜ ውስጥ ለድል እንደሚበቃ ጥርጥር የለውም  እንስራ እንጠ	positive
ሰላም ግንባታ ምንድንነው ስለ ሰላም ግንባታ መሰረታዊ ትውውቅ  ማወቅ ለምትፈልጉ ሁሉ ያላችሁን ጥያቄዎች በትዊተር  ብታደርጉ በተቻለኝና ጊዜ በፈቀደ መጠን	neutral
እሺ እንተጋለን የተባረክ መሪ ነህ መልካም ስራህን ቀጥልበት ኢትዮጵያ ወደ ብልፅግና	positive
ቃል እግዚአብሄር ነበረ             ዮሀ ወንጌል ፩፩     ቃል ስጋ ሆነ  ፀጋንና እውነትንም ተመልቶ በእኛ አደረ        ዮሀ ወንጌል ፩፲፬	neutral
እንኳን ለየሱስ ክርስቶስ የልደት በአል በሰላም አደረሳችሁ                                         በአሉ የሰላምየጤናየብልፅግናይሁንልን	neutral
ኢትዮጵያን ማፍረስ የሚፈልግ እሱ ራሱ ይፍረስ አላህ ኢትዮጵያን ይባርክ በእምዬ ድርድር የለም ባይሆን እምዬነቷ ለሁሉም እንዲሆን እስመጨረሻ እስትንፋሳችን እንታገላለን	positive
የመኖር ዋስትናችንተስፋችን መመስረት ያለበት ነፃ አውጥቸሀለሁም ነፃ አወጣሀለሁም በሚሉ ፖለቲከኞች ላይ ሳይሆን በህዝቡ የኖረ ያኖረንና የሚያኖረን የዳበረ የአብሮነትየመ	neutral
የአፄዎቹ ኢትዮጵያ ያልጣመችዉ ዉልቅ ጥርግርግ ይበል   ማስታወሻ  ሽኝቱ በኛ ሙሉ ወጪ መሆኑን ከወዲሁ በአክብሮት እንገልፃለን    ከሰላምታ ጋር 	neutral
እንዴ ፌሪ እኔ እኮ እዚ የመጣሁት አንቺን ከአጥፊዎች ልከላከል ነው	positive
ለጠላ ያለኝን ፍቅርን አማልክቱም ያውቃሉ እንደው እኔንም አትርሳኝ	neutral
የአገር በቀል መገናኛ ብዙሀን ተልኮ እና ሚና ምንድን ነው ጋዜጠኞችስ እነሱ የሚፈልጉትን ነው ወይንስ የሚገባውን ነው ማስተላለፍ ያለባቸው እንደ አገርስ	neutral
የሞጣ ሙስሊም ግን ከምን አይነት ሰው ጋር ነበር ሲኖሩ የነበሩት የሙስሊሙ ሱቅ ታቃጥሎ ሀዘን ተቀምጦ ውስጡ ተጎድቶ የአቃጣይ ወገን ሱቁን ከፍቶ ሲሸጥ እሱ ባያፍር እኔ አፈርኩምን	neutral
አንዱ በኮሜንት የባንዲራዋን ኮከብ ሰማይ ላይ ፈልጋት ብሎኝ ስፈልግ ባህርዳርና ደሴ አገኘኋት  ድሮም መላጣ መሸሽ ልማዱ ነው 	neutral
ይለወጣሉ  የሚሰማቸው ህመ  ይለወጣሉ  የሚሰማቸው ህመም ሊቋቋሙ የማይችሉት ይለብቻዎ ትሆናላችሁ  የምትወዳቸው                               	neutral
ጥፋት ሳላጠፋ በእርከን ፬ ተከስሼ ለማን አቤት ይባላል	negative
ደሞ ገና መጣ  የገና ጨዋታ መጫወቻ ኳስ ምንድን ነው ስሟ  ጂኒ ጃንካ እያሉ ጋሽ  ውብሸት ወርቃለማሁ አዛ ሊያረጉን ነው 	neutral
በሰለጠነ ህዝብ ቢሆን በተቃውሞ የድርጅቱ ሀላፊው ከስልጣን ያስነሳ ነበር የኛ ህዝብ ግን እያለቀሰ ያጨበጭባል	negative
ለምን ደሞ የአዋቂ ዳይፐር ላይ ደሞ አትሰሪም ለአንድ ሶስት ወር በዛች ሴትዮ መሸለም ትንሽ ቅር ተፅተሽ ነበር አሉ ምነው ግን አይደበርም	negative
እና ነገ ቅዳሜ ሊሆንልሽ ነዋ	neutral
ተመሳስሎብህ ነው እሱ አይደለም	negative
ረሀብ አድማ 	negative
እኛን ወደ መቀሌ ያባረረን አዴፓ ነው	negative
የዛኔ ሏላዊ ሀገር መሆናቸውን ክደን ነበር እንዴአሁን አልፏልአስተምሮን ካላለፈ ነገ አቅሙን ሲያጠናክርና እላፊ ጥቅም ሲፈልግ ያ ላለመደገሙ ምን ማረጋገጫ አለን	neutral
እሺ የሚስቶች ጠበቃ ነኝ አልሽሳ	negative
ለዘላለም ተኛ	neutral
አንች ልጅ       ጭንቅላቱንየእኔን እያነበብሽ ፃፊ የተባልሽ እኮ ነው የምትመስይው ምን ጉድ ነው ለማንኛዉም  ብያለሁ	neutral
እኔ የጎጃም ነፃ አውጪ ግንባር አቋቁሜ አባላት አስመለምልሀለኋ 	negative
ሞባይል ወይ ላፕቶፕ ውጦ መሞት አይቻልም  ሞት ለሶስተኛ ወገኖች  መብታቸው አፈር ይብላ  አብዮት ይፋፋምባቸው  ግዴታቸው ከአለት ይክበድ          	negative
እኔ ምለው ትክክለኞቹን  ቤቶች የት ነው ሚገኙት እንዴትስ መለየት ይቻላል     ብርድ ሳይመታኝ አልቀረም ግን ጎረምሳም እንዲያሸኝ አልፈልግም	neutral
  ከፈረንጁ ጋር ያለችው ቆንጅዬ ይሄን ትዊት ባየች ጊዜ ኮሚቴውን ወጋሁት አለች የሚባለው እውነት ነው እንዴ 	positive
አብቹ ለለውጥ ምሳሌ የሆነ መሪ ነው ለውጥ ደግሞ የሁላችንም ሜዳ ውስጥ ገብቶ መጫወት የሚፈልግ ሂደት ነው ሁላችንም የመሪያችንን መልካም ተግባራት ተከትለን ለሀገራችን ብልፅግና እንስራ	positive
  አሁን ላይ ከዳር ቆመን የምናይበት ጊዜ አይደለም ከዳር ቆሞ ማየት መብትን አሳልፎ መስጠት ነው  የኢዜማ መሪ  ብርሀኑ ነጋ ፕሮፌሰር ዛሬ እሁድ በነጋ ቦን	neutral
የሴራውን በአል ምክንያት በማድረግ ትውልደ ሀላባዎች ከአጋሮቿ ጋር በሀዋሳ ከተማ በደማቅ ሁኔታ ተከብሯል	positive
አንተ ደግሞ ቶሎ የሚከፋህን ፀባይ እስካሁን አላሻሻልክም	negative
እና ህይወት ብያኔ እና ባህላችን ሚዛን አጠባበቃችን በተለይ አያድርስ ከሚባሉ የጤና ዱብዳዎች ጋር ተያይዞ ጨዋታ የአይዳ ታደሰ ግጥም የሚያሸልም ጥያቄ  ደቂቃዎች አብራችሁን ቆ	neutral
የመጨረሻ እስትንፋሳ እስኪያደርጉ ድረስ ከፍተኛ ስቃይ ይሰማዎታል  የደምዎ መስመር ይሰቃያል እናም ከሞተ በኋላ ወደ ሲኦል ዋሻዎች ይገባል ከሰራው ሀጢአት እራ	neutral
እረ ምንም የሚያፅናናም የሚያስከፋም ነገር የለውም እውነት ነው የተናገርኩት ዋሸሁ እንዴ ደሞ ቋንቋ በቤተሰብ እና ባደክበት ነው በዘር ወይም በደም አይወሰን ምን አስጨነቀህ	neutral
የሚያደርገው ምንድነው   ማእከላዊ 	neutral
ሀኒ ያገራችን ልጅ ስለመሆኖ እያጣራን ነው አንቺን ማን ጠራሽ እዚ	neutral
፮   ሰማእቷ በምልጃ ፀሎቷ ሀገራችንን   ኢትዮጵያ ከክፉ ሁሉ ትታደግልን አሜን   ሰላም ለሀገራችን	positive
ጀንጅኜ አሳምኛታለው ብለህ  በቃ ይቺንማ ለትዳር ነው ብለህ ባለህ ሁሉ ስትንከባከባት ቆይተህ መሀል ላይ አንድ ቀን እንዲህ ትልሀለች ቆይ ከሁለታችን ማን ቀድሞ የሚያገባ ይመስልሀል	neutral
አሁን አሁን ህፃናትን በማቆያ ማሳደግ እየተለመደ መጥቷል ለመሆኑ ይህ ትንሹ የህፃናት አለም ምን ይመስላል   መልካም ቆይታ	positive
የሙስሊሞች የውጭ ጠላት ከየ አቅጣጫው በበዛ ቁጥር  የእርስ በርሳቸው የውስጥ አንድነት ይበልጥ ይጠናክራል ጠላትንም በጋራ ዲል ያድርጋሉ	neutral
የመንግስት ፕሮጀክቶች የሙስና ተጋላጭነት	neutral
የኔ ጀግና የኔ ክብር የኔ ቴዲ	positive
አልተሰማኝም ምነው ካለፈው ቀለልክ	negative
ምርጥ ስራ ነው አቤል	positive
በልሎች አገሮች ሶማሊያ እና ናይጄሪያ ለምሳሌ የምንሰምቸው የወንጀልኞች ቡድኖች አጀማመራቸው እንዲህ ነበር መንግስት እኒህን ወንጀለኞች ትልቅ ኢላማው ማድረጉ ተገቢ ነው ለሰላም	neutral
ቤቲ ለመማር ያላት ፍላጎት ከፍተኛ ነው   ጀዋርን አይን አይኑን ነው ምትመለከተው	positive
ምን ይደረግ መርህ የሌለው መደዴ ፖለቲከኛ በዛ የሀገሩን ጥቅም በኢጎ ቅርጫት ውሰጥ ከቶ የሚያላዝን የውስጥ ጉዳይን ከሀገረዊ ጥቅም የማይለይ  ሚሊዮን ህዝብ ተሸክሞ 	negative
ገቢዎችየኮንትሮባንድቁጥጥሩንአጠናክሯል        ሳምንቱን አራት ሚሊየን  ብር የሚጠጋ ዋጋ የሚያወጡ የኮንትሮባንድ እቃዎች ተያዙ	neutral
ፎቶውንም አይቼ የማውቀው ሰው አይደለም	neutral
ታድያ ምን ይጠበስ እናንተን አይመለከትም ደግሞ አብይ እኮ የውያኔ  መድሀኒት ነው የቡዳ መድሀኒት ሲሉም አልስማሽ	negative
ሰውዬ ችግር ውስጥ አታስገባኝ	negative
ባህርዳር የማይነካውን ስትነካ እናቶችም ቤታቸው አይቀመጡም	neutral
አንተም ተዘጋጀ የአነተም ፀጉር አያልፍም ምነዉ አላየህዉም እንዴ ፀጉርህ መመለጥ ጀምሯል	negative
ኢትዮጵያ ከጎረቤት ሀገራት ባለፉት ሁለት አመታት  ነጥብ  ሚሊዮን የአሜሪካ ዶላር ከሀይል ሽያጭ ማግኘቷን የኢትዮጵያ ኤሌክትሪክ ሀይል አስታወቀ	positive
ክንፈ  ብለህ ብለህ ለዘራፊ ጥብቅና ቆምክ ዘረኛ	negative
የኦሮሞን ህዝብ ትግል ከግብ እናደርሳለን ብለው ለህዝቡ ቃል ከገቡ  አመት ሳይሞላቸው ህዝባችንን ከካዱ     ለህዝቡ ቃል ከገ	negative
 ክቡር ፕሬዝዳንት ለማ መገርሳ በምእራብ ኦሮሚያ ወለጋ አከባቢ የሚደረገውን ጦርነት በመቃወም በግላቸው እረፍት ወጥቷል  በዛሬው እለት ውጭ ሀገር እንደ	positive
የሚያዝናናው እዚህ ሰፈር ያሉ ባለብዙ ተከታዮች እንደዚያ የሚያምኑ አሉ 	neutral
ምናለ በጌታ ልደት ቀን እንኳ ይኼ ክፉ ልሳንህን እረፍት ብትሰጠው	neutral
በናትህ ትናንት ታክሲ ስትሳፈር አይቼህ ቻፓህ በጣም ሴፍ ነው ደሞ ማለት ነው ባለፈው ከጀለሶቼ ጋ ሆኜ አንተ ስታልፍ ድንጋይ የወረወርኩብህ ሎሚ ስላልነበርኝ ነው እሺ ደሞ እንዳታ	neutral
የት ነው ሂሳብ የተማረው ደደቢት	negative
ሞትን ከዩኒቨርስቲ አመለጥነው ሲሉ መንገድ ላይ አስቀራቸው የወገኖቻችን ሞት የማያስደነግጠን ደረጃ ላይ ደረስን 	negative
ነገር ግን ሰላማዊ ትግል ላይ ያለውን አቋም ለአፍታም ቀይሮ አያውቅም  	positive
የኤርትራን ፖልስ እንደ አርሲ እና በሌ አቅም ይለለውና ከዱላ ውጭ ምንም እንደኖር ማድረግነው ስትል እውነትም ጥሬ ስጋ መብለት ከሰውናት እንደ ምያወጠና ከአውሬ ጎኒ	neutral
የሚያስወግድ ነገር አንዳች ያስወግድ ጥንብ ዘረኛ እንዳንተ አይነቱ አስመሳይ የኢዜማ ቡችላ በውሸት ማንነት ተደብቆ ፀረ አማራ ጠል ፕሮፓጋንዳ ትነዛላቹ መርዝ ወረኛ ጥንብ ዘረኛ	negative
የአዋሽ ባንክ የባለአክሲዮኖች ኛ መደበኛና ኛ ድንገተኛ ጠቅላላ ጉባኤ ላይ ወሳኝ የሚባሉ ውሳኔዎቸ ተላልፏል በዚህ መሰረት የባንኩ ካፒታል ከ ቢሊዮን ብር ወደ  ቢሊ	neutral
በደቂቃወች ልዩነት አብይ አማራ ክልል ላይ ኮሽ ስትል ወጦ የእባብ ምላሱን ሲዘረጋ የኛዋ አተላ ደሞ ተቀብላ ይሄን ለማውገዝ ሰው መሆን በቂ ነው ትልሀለች እዚ ለይ	negative
መልካም ዜና ይኼውልህ  የኢየሱስ ክርስቶስን ልደት ምክንያት በማድረግ ነገ ከጧቱ   ላይ  ጊዜ መድፍ እንደሚተኮስ የመከላከያ ሚኒስቴር አስታወቀ	positive
አይደለም እንዴ	neutral
መልካም አዲስ አመት	positive
ራእይ    በደምም የተረጨ ልብስ ተጐናፅፎአል ስሙም የእግዚአብሄር ቃል ተብሎአል	positive
ምርጫው ዴያሰፓራው ላይ ከሆነ ነዋ	negative
የትኛው የአዋልድ መፅሀፍ ነው እንደዛ የሚል አዋልድ ማለት ደሞ ከመፅሀፍ ቅዱስ የተወለደ እንጂ ሌላ ትርጉ	neutral
ኛ  በሀሳዊያን በሚዘወር የትዊተር አካውንት የተለቀቀ መረጃ እየተቀባበሉ ማሰራጨት በራሱ እኩይነት ነው  ኛ  ቋንቋ ከመግባቢያነት ያለፈ መሪዎች የሀገር ጥቅም ለማስጠበቅ ያላቸ	positive
የህግ ስዎችን እንዴት ማሸነፍ እንዳለበት የሚያውቀው እሱ ብቻ ነው ሲመጣ መደበቂያ ፈልጉ	neutral
የከምባታ ጠምባሮ ዞንክልል ሆኖ ለመዋቀር ያቀረበው ጥያቄ በደቡብ ክልል ምክር ቤት እንዳይቀርብ ተደርጓል የሚል ክሱን ለፌዴሬሽን ምክር ቤት አቀረበ ዞኑ ወይዘሮ ኬሪያ ኢብራሂም የሚ	neutral
የአማራ ክልል መንግስት መግለጫ ኢጅነር ስመኘው እራሱን አጥፍቶ ነው የሚለውን ቀልድ ሙስሊሙ  መስጅዱን  ያቃጠለው ከሚለው ጋር አንድ ነው 	negative
እኔ አላምንም ኧረ ቅሌት	negative
ልክአደላችሁም ንብረታችንን የምርምር ስራ ከነፓተንቱ አይሸጥም ስንል ኦሮሞ ስለሆናችሁ ነው ይሉናልእኛ ዶአብይ እስካሉ አንናገርም ንብረታችንን መሸጥ ቀርቶ ይረዱን ብልፅግና ከሚደናቀ	negative
መልካም እሴቶቻችንን የምንጠብቀው ችግሮቻችንን በመደበቅ ወይንም በአድልዎ  ዜጎቻችንን በማየት አይደለም ዩኒቨርስቲዎቻችንን ሙያተኛ ማፍሪያ እንጂ በድንጋይ	positive
ካድሬዎቻችን ለአናሳ ትግሬ አይላላኩ እንጂ ለሌላ ቢላላኩ ችግር የለውም በአንድ አመት  አመት ያልሰራች	negative
ብልፅግናችሁን  ብሉ     ታክስ መጨመሩ    በብልግና ፅ ምክንያት  ነው	negative
ኛ እር የዘመናት ሁሉ ባለቤት ዘላለማዊ ነው የእር ዘላለማዊነት ከነበረው ነገር ሳያጎል አዲስም ነገር ሳይጨምር መለወጥ የሌለበት ነው እር በግዜ አይሰፈረም ምክንያቱም ግዜ እ	positive
አሁንም የሀወሀትን በዥታና ማወናበድን አጥልለህ ስታየው ተመሳሳይ እውነታ ነው የሚኖረው	negative
ታህሳስ   ኢትዮጵያውያን ባለሀብቶች ከውጭ ኩባንያዎች ጋር በሽርክና ከሚያከናውኗቸው ፕሮጀክቶች ከ በላይ የሚሆኑት ወደ ምርት ገብተዋል ተባለ	positive
ማማማማማማማ እኔ በስማም በል አረ ልጅ አገርድ ነኝ  ይሚሉ ሴቶች ምን ፈጃቸው	neutral
ሁሉም ሰው በሚጠቀምባቸው ቻርጅ ማድረጊያዎች ስልኮትን ወይም ታብሌቶችን ቻርጅ ማድረግ ለተለያዩ ስልክ ጠላፊዎችና ጥቃቶች ሊያጋልጥ ይችላል 	neutral
የእግዚአብሄር ጥበቃ አገራችን ላይ ይሁን 	positive
እነሱ እንደ ሰው የሚያስቡ አይምሰልህ ውስጣቸው ያከማቹት በክፋት የተሞላ እብሪት ጦርነት ለመጀመር በቂ ነው በዚያ ላይ የተፈረካከሰው የብርሀኑ ጁላ ጦር አይመክታቸውም	neutral
የታምራት ነገራ ብቸኛ  ጥፋት ቂል አለመሆኑ ነው	neutral
አደራህን ትንሽ ፈታ አርገው	positive
ጋና የብሄራዊ ቡድን የእግር ኳስ አስልጣኞችን በሙሉ ከስራ አሰናበተች	neutral
እናንተ እኮ የዋህ ናችሁ እስኪ አንድ ሁለት አማካኝ ልቀቁብን	neutral
